,источник,дата,заголовок,текст
17,https://theblueprint.ru/news/14606,30.01.20,Грета Тунберг зарегистрирует свое имя как товарный знак,"Грета Тунберг рассказала в Instagram, что подала заявку на регистрацию своего имени как товарного знака. Так экоактивистка хочет запретить компаниям использовать свое имя в целях, которые не сходятся с ее ценностями. Грета также планирует официально зарегистрировать свое движение FridaysForFuture. «Мое имя и #FridaysForFuture постоянно используют в коммерческих целях, не спрашивая разрешения. Так поступают маркетологи, рекламные агенты и люди, собирающие деньги от моего имени и от имени моего движения», — написала она в своем аккаунте. О том, как шестнадцатилетняя школьница из Стокгольма стала знаменитой и добралась до звания «Человека года» по версии Time, мы писали тут."
18,https://theblueprint.ru/news/13994,17.12.19,Про экоактивистку Грету Тунберг снимут документальный фильм,"Стриминговый сервис Hulu выпустит документальный фильм о 16-летней экоактивистке Грете Тунберг, которую на прошлой неделе назвали «Человеком года» по версии Time. В шортлист номинантов на это почетное звание вместе с ней вошли американский политик Нэнси Пелоси и президент США Дональд Трамп (последний очень расстроился после «проигрыша» — и даже опубликовал язвительный твит по этому поводу). За работу над фильмом возьмутся продюсеры Сесилия Нессен и Фредерик Хейниг. Режиссером станет Натан Гроссман. Ожидается, что премьера состоится в 2020 году. Грета Тунберг прославилась как 16-летняя активистка из Швеции, которая пропускала школьные занятия по пятницам, чтобы проводить одиночную «школьную забастовку за климат» у здания шведского парламента. О том, как она пришла к собственным выступлениям на TEDx, речам перед представителями ООН и званию «Человек года» по версии Time, можно узнать тут."
19,https://theblueprint.ru/news/14393,21.01.20,Bvlgari поддержали производство жасминав Индии ,"Bvlgari вместе с брендом ароматов Firmenich и его индийским партнером Jasmine Concrete запустили проект, поддерживающий производство жасмина в Индии. Благодаря инициативе Flower Gems of India сто семейных ферм внедрят в работу новый способ выращивания. Планируется, что он станет более экологичным, прибыльным для фермеров и повысит качество цветов. Директор Jasmine Concrete Раджа Паланисвами считает, что соглашение повысит уровень благосостояния местного населения."
20,https://theblueprint.ru/news/15829,23.04.20,Художник Олафур Элиассон представил  проект ко Дню Земли вместе с галереей Serpentine ,"Датско-исландский художник и дизайнер Олафур Элиассон объединился с лондонской галереи Serpentine для создания нового проекта «Перспективы Земли». Эта инициатива является частью 50-летней программы Serpentine Gallery «Возвращение на Землю», в которой представлены произведения искусства, посвященные климатическим изменениям. «Перспективы Земли» Элиассона включает девять изображений, каждое из которых указывает на определенную географическую точку на земном шаре. Если смотреть на точку в течение десяти секунд, а затем перевести взгляд на пустую поверхность, то можно будет увидеть новое изображение в других цветах. По словам художника, это «буквально дает нам новый взгляд на мир». «Сегодня выражение „мир, каким мы его знаем“ — это фраза прошлого. Нынешний кризис затронул все сферы нашего общества: экономику, гражданские свободы и даже наши социальные связи. Мы должны сопереживать всем пострадавшим от этой международной катастрофы. Кроме того, мы должны воспользоваться этой возможностью, чтобы вместе представить себе Землю, на которой мы хотим жить в будущем — во всех ее чудесах и красоте. Проект „Перспективы Земли“ представляет нашу планету, на которой мы хотим жить вместе, думая не только о человеке и его потребностях, но и о растениях, животных и природе в целом», — рассказал про запуск художник. На изображениях Элиассона можно увидеть Большой Барьерный риф в Австралии, реку Ганг в Индии, Чернобыль, Припять, Украину в целом, Южный полюс и другие точки нашей планеты."
21,https://theblueprint.ru/news/13987,16.12.19,ASOS подписали соглашение по устойчивому развитию с фондом Элен Макартур,"ASOS и благотворительный фонд Элен Макартур подписали соглашение по устойчивому развитию. Теперь британский ритейлер будет использовать меньше пластика для упаковки товаров, а к 2025 году откажется от одноразовой обертки. Все пакеты компании будут выполнены из материалов, которые разлагаются или перерабатываются. Чтобы сократить выбросы, ASOS позволит клиентам сдавать упаковку на переработку. О том, какие еще инициативы вводятся для того, чтобы модная индустрия наносила меньше вреда экологии, мы писали тут."
22,https://theblueprint.ru/news/15716,14.04.20,"Pinterest запускают онлайн-магазин для поддержки эко-брендов, пострадавших от коронавируса","Сотрудники компании Pinterest рассказали, что за последние несколько недель количество поисковых запросов с ключевыми словами «поддержка малого бизнеса» со стороны пользователей сайта увеличилось на 351%. В связи с этим компания решила запустить онлайн-магазин The Pinterest Shop для поддержки локальных эко-брендов, пострадавших от пандемии коронавируса. В нем можно будет купить различные аксессуары, косметику и товары для дома — все продукты соответствуют принципам устойчивого развития. «Pinterest предлагает покупателям возможность находить новые уникальные продукты и дизайнерские решения. Pinterest Shop создан для поддержки локальных брендов,которые нуждаются в финансовой помощи больше, чем когда-либо», — рассказала глава маркетинг-отдела Pinterest Колин Штауффер."
23,https://theblueprint.ru/news/14295,16.01.20,Versace больше не будут использовать кожу кенгуру в своих коллекциях,"Versace отказались от использования кожи кенгуру. Это решение было принято еще в прошлом году — модный дом не включил вещи из кожи животного в коллекцию 2019 года, однако известно об этом стало только сегодня. Отказ от использования этого материала связывают с природными пожарами в Австралии, но есть мнение, что решение принято в ответ на протесты зоозащитников. В ответ на принятие нового положения представитель итальянской организации по защите животных LAV Симона Павеси поддержала модный дом, сказав, что одобряет такой подход."
24,https://theblueprint.ru/news/13164,13.10.19,В Калифорнии запретят продажу меха,"Губернатор штата Калифорния Гэвин Ньюсом одобрил запрет на производство и продажу новых изделий из меха животных. Закон вступит в силу в 2023 году. Под запрет попадут одежда, сумки, обувь, тапки, связки для ключей и головные уборы из натурального меха. Закон не распространяется на кожу, шкуры животных и мех, который используется в религиозных обрядах. Еще одно исключение — меховые изделия, произведенные до принятия закона. Помимо этого, в Калифорнии запретят охоту на красных рысей и цирковые выступления диких животных, таких как медведи и слоны. «Калифорния — лидер по защите животных. Сегодня это подразумевает запрет на продажу меха. Но мы идем дальше. Мы заявляем всему миру, что такие прекрасные дикие животные, как медведи или тигры, не должны выступать на трапеции или прыгать через огонь», — заявил Гэвин Ньюсом. После принятия закона Калифорния станет первым штатом CША, официально запретившим производство и продажу изделий из меха."
